{
  "schemaVersion": "case-v0.1",
  "caseId": "CASE-000003",
  "title": "Quiet ADL day - must stay idle",
  "traceId": "trace-003-adl-quiet-day",
  "subject": {
    "profile": "elder-alone"
  },
  "groundTruth": {
    "outcome": "NON_EMERGENCY",
    "basis": "synthetic_design",
    "notes": "Ordinary daily living; the false-positive floor case."
  },
  "expected": {
    "version": 1,
    "outcome": "no_incident",
    "statePath": [
      "IDLE"
    ],
    "mustNever": [
      "any escalation"
    ],
    "derivedFrom": [
      "H-02",
      "SRS-903"
    ],
    "review": {
      "reviewedBy": "pair-architect (Claude), founder execution charter 2026-07-21",
      "date": "2026-07-21",
      "reason": "Initial migration from 6-trace corpus; expectations transcribed from trace prose descriptions + SRS/doctrine derivations, v1."
    }
  },
  "pinnedBehavior": {
    "goldenHash": "4ef1a6681ca41a813246bd6a7efe26c6ce592fc5a802bf43b211307f31f1c481",
    "baselineRef": "harness/baseline/golden-hashes.json"
  },
  "adjudication": {
    "status": "NOT_EXECUTED",
    "note": "Ground-truth adjudication NOT_EXECUTED: the CaseKit runner does not exist yet (I1 commit 2). Pin is live via VV-101 (baseline MATCH). The laboratory does not claim adjudications its instrument cannot yet perform."
  },
  "provenanceClass": "SIMULATED",
  "links": {
    "hazards": [
      "H-02"
    ],
    "vv": [
      "VV-101"
    ]
  }
}
